{
  "schema_version": "nma.generic-contract-interface-closure/1.0",
  "closure_id": "GEN-01",
  "closure_sha256": "03b80441bbf317ac2e2b6cd92c3a86309c4cc7465109a3d34b6d24636491c35d",
  "verdict": "PASS — GENERIC CONTRACT AND DOMAIN INTERFACE CLOSED",
  "architecture_principle": "Generalize contracts, not domain knowledge.",
  "canonical_repository": "https://github.com/dongpo/topoMap.git",
  "branch": "gen/gen-01-generic-contract-interface-closure",
  "predecessor": {
    "branch": "gen/gen-00-feature-production-generalization-audit",
    "commit": "b745a98f8d465259a2cb7c2b3af3df112a10ea37",
    "audit_sha256": "2e96f00ada42e22c7dc50387cb1fbf651b6fcbbdff94af796c0fd1985ffe86e3",
    "verdict": "PASS — GENERALIZATION PARTIAL; DOMAIN BOUNDARIES REQUIRE CLOSURE",
    "artifacts_preserved": true
  },
  "scope": {
    "architecture_contract_only": true,
    "production_implementation_created": false,
    "frozen_code_modified": false,
    "private_archive_inspected": false,
    "riverl_implemented": false
  },
  "frozen_identities": {
    "build_final": {
      "commit": "95de5fa3657a2c8ac7847f1ee1010c48ea984cd7",
      "tag": "nma-build-v1.0-final",
      "annotated": true
    },
    "core_final": {
      "commit": "5eb138ae7686502431587743ebce9ddf92c5a799",
      "tag": "nma-core-v1.0-final",
      "annotated": true
    },
    "road_final": {
      "commit": "325c70d5335f57c43a8af85822db25032aa225c3",
      "tag": "nma-road-v1.0-final",
      "annotated": true
    },
    "school_hero": {
      "commit": "56f99eb9ae63272a68accac3041fb10eacefb986",
      "branch": "freeze/hero-final-school-hero-56f99eb"
    }
  },
  "contracts": {
    "lifecycle_envelope": {
      "contract_id": "nma.generic-lifecycle-envelope",
      "contract_version": "1.0",
      "schema_path": "schemas/generic-lifecycle-envelope-v1.0.schema.json"
    },
    "domain_adapter_capability": {
      "contract_id": "nma.generic-domain-adapter-capability",
      "contract_version": "1.0",
      "schema_path": "schemas/generic-domain-adapter-capability-v1.0.schema.json"
    },
    "closure_record": {
      "contract_id": "nma.generic-contract-interface-closure",
      "contract_version": "1.0",
      "schema_path": "schemas/generic-contract-interface-closure-v1.0.schema.json"
    }
  },
  "core_identity_boundary": {
    "authority_count": 1,
    "fallback_authority_count": 0,
    "provider": "nma.core.canonical_sha256",
    "canonicalizer": "nma.core.canonical_json",
    "dependency_required": true,
    "missing_dependency_behavior": "fail-closed",
    "production_mutation_before_failure": false
  },
  "lifecycle_decision": {
    "stage_sequence_is_generic": false,
    "domain_payload_is_opaque": true,
    "mandatory_envelope_fields": [
      "schema and contract version",
      "envelope and artifact identity",
      "domain and adapter contract identity",
      "capability declaration reference",
      "lifecycle role",
      "parent and provenance linkage",
      "authorization requirement and linkage state",
      "canonical Core identity dependency",
      "pre-mutation validation result",
      "opaque domain payload",
      "domain ownership declaration",
      "non-authorizing mutation boundary"
    ],
    "mandatory_capabilities": [
      "domain identification",
      "contract and version declaration",
      "input validation",
      "canonical Core identity consumption",
      "authorization consumption before mutation",
      "planning boundary",
      "execution boundary",
      "derived output reference",
      "observation production",
      "receipt production",
      "provenance reporting",
      "verification boundary",
      "capability declaration"
    ],
    "optional_declared_capabilities": [
      "rollback evidence",
      "activation evidence",
      "release evidence"
    ],
    "not_mandatory": [
      "one universal stage sequence",
      "a local intent or authorization issuer",
      "a standalone production-contract artifact",
      "rollback behavior",
      "production activation behavior",
      "a ROAD or BUILD style release manifest"
    ]
  },
  "adapter_decision": {
    "contract_id": "nma.generic-domain-adapter",
    "contract_version": "1.0",
    "form": "conceptual-machine-verifiable-sidecar",
    "runtime_framework_created": false,
    "capabilities": [
      "domain identification",
      "contract and version declaration",
      "input validation",
      "canonical identity consumption",
      "authorization consumption",
      "planning boundary",
      "execution boundary",
      "observation production",
      "receipt production",
      "provenance reporting",
      "verification boundary",
      "optional capability declaration"
    ],
    "generic_must_not": [
      "interpret domain payload",
      "issue production authorization",
      "execute a domain mutation",
      "repair source or derived content",
      "perform rollback",
      "perform activation",
      "substitute an identity provider"
    ]
  },
  "capability_declaration_decision": {
    "required": true,
    "machine_readable": true,
    "minimum_fields": [
      "domain identifier and contract version",
      "adapter contract identity and version",
      "canonical identity dependency and no-fallback rule",
      "mandatory lifecycle boundary capabilities",
      "optional rollback activation and release capabilities",
      "domain semantic geometry portrayal verification and provenance contract references",
      "domain ownership rules",
      "fail-closed dependency behavior",
      "non-authorizing mutation boundary",
      "canonical declaration identity"
    ],
    "universal_feature_ontology_created": false,
    "riverl_specific_fields": false,
    "production_authority_granted": false
  },
  "domain_owned_responsibilities": [
    {
      "area": "semantics",
      "owner": "DOMAIN_OWNED",
      "generic_may_carry": ["semantic contract identity", "semantic contract version", "evidence reference"],
      "generic_must_not": ["interpret feature meaning", "invent classifications", "resolve ontology or schema meaning", "apply domain eligibility rules"],
      "evidence_paths": ["src/nma/school_hero_execution.py", "src/nma/road_resolution.py", "build_contracts/resolution.py", "GEN-00-Generalization-Audit.md"]
    },
    {
      "area": "geometry",
      "owner": "DOMAIN_OWNED",
      "generic_may_carry": ["geometry contract identity", "geometry contract version", "derived artifact reference"],
      "generic_must_not": ["construct or repair geometry", "interpret topology", "drop dimensions", "perform domain transformations"],
      "evidence_paths": ["src/nma/school_hero_execution.py", "src/nma/road_execution.py", "build_contracts/building_production_implementation.py", "GEN-00-Generalization-Audit.md"]
    },
    {
      "area": "portrayal",
      "owner": "DOMAIN_OWNED",
      "generic_may_carry": ["portrayal contract identity", "portrayal contract version", "output artifact reference"],
      "generic_must_not": ["choose symbols or styles", "construct labels or shields", "set layer ordering", "apply rendering rules"],
      "evidence_paths": ["src/nma/school_hero_execution.py", "src/nma/road_portrayal_decision.py", "build_contracts/building_production_implementation.py", "GEN-00-Generalization-Audit.md"]
    },
    {
      "area": "rollback",
      "owner": "DOMAIN_OWNED",
      "generic_may_carry": ["capability declaration", "rollback evidence identity", "rollback references", "lineage linkage"],
      "generic_must_not": ["remove domain artifacts", "restore domain state", "select cleanup operations", "mutate production state"],
      "evidence_paths": ["src/nma/school_hero_execution.py", "src/nma/road_execution.py", "build_contracts/building_production_activation.py", "GEN-00-Generalization-Audit.md"]
    },
    {
      "area": "activation",
      "owner": "DOMAIN_OWNED",
      "generic_may_carry": ["capability declaration", "activation evidence identity", "activation status reference", "lineage linkage"],
      "generic_must_not": ["grant activation authority", "evaluate domain readiness gates", "activate production", "bypass domain authorization"],
      "evidence_paths": ["build_contracts/building_production_verification.py", "build_contracts/human_building_production_activation_authorization.py", "build_contracts/building_production_activation.py", "GEN-00-Generalization-Audit.md"]
    }
  ],
  "invariants": [
    {
      "id": "GINV-01",
      "status": "ACCEPTED",
      "normative_statement": "Every generic lifecycle identity and adapter declaration MUST consume nma.core.canonical_sha256 over nma.core.canonical_json.",
      "evidence_paths": ["src/nma/core/identity.py", "src/nma/school_hero_execution.py", "src/nma/road_resolution.py", "build_contracts/building_production_implementation.py"],
      "enforcement": ["closed schema constants", "canonical self-hash tests"],
      "test_coverage": ["test_canonical_core_identity_is_single_and_fail_closed", "test_closed_schemas_and_canonical_closure_identity"]
    },
    {
      "id": "GINV-02",
      "status": "ACCEPTED",
      "normative_statement": "A generic adapter or domain MUST NOT silently substitute a fallback, compatibility, local, or shadow identity authority.",
      "evidence_paths": ["src/nma/core/identity.py", "data/specifications/nma-gen-00-feature-production-generalization-audit-v1.0.json"],
      "enforcement": ["identity provider const", "fallback_allowed false", "fallback authority count zero"],
      "test_coverage": ["test_canonical_core_identity_is_single_and_fail_closed", "test_lifecycle_envelope_rejects_missing_extra_version_and_identity_dependency"]
    },
    {
      "id": "GINV-03",
      "status": "ACCEPTED",
      "normative_statement": "Missing mandatory Core identity, contract, or authorization dependencies MUST fail closed before production mutation.",